{
  "{}": {
    "error": "",
    "response": {
      "person": {
        "name": "Jewell Jakubowski",
        "age": 34,
        "job": "Environmental Scientist",
        "incomeUSD": 71048,
        "creditScore": 580,
        "ccNumber": "6759-4449-1818-0456",
        "married": true,
        "hasChildren": true,
        "height": 160.0,
        "weight": 60.6,
        "eyeColor": "GRAY",
        "email": "jewell@hotmail.com",
        "gender": "Female",
        "hasDegree": true,
        "bloodType": "B-",
        "username": "jewell98",
        "politicalLeaning": 0.06,
        "religion": "Christianity",
        "address": {
          "streetAddress": "150 Blanda Squares",
          "city": "Dubai",
          "state": "Al Fujayrah",
          "country": "United Arab Emirates",
          "zip": "6235",
          "geonameId": 292953,
          "phoneNumber": "+971 770697884",
          "ipAddress": "208.56.157.191",
          "countryCode": "AE"
        },
        "doB": "Sun Apr 15 05:41:47 UTC 1990",
        "gpa": 2.7
      },
      "lifestory": "Jewell Jakubowski is a 34-year-old who was born on Sun Apr 15 05:41:47 UTC 1990. Jewell works as a environmental scientist and lives in Dubai, Al Fujayrah, United Arab Emirates. She is married and has children. She is 160.0cm tall and weighs 60.6 kg, and has gray eyes and a blood type of B-. She has a GPA of 2.7, and has a degree. Her income is $71048, and she has a credit score of 580. Her credit card number is 6759-4449-1818-0456. She uses jewell@hotmail.com for her email address and jewell98 for Her username on various websites. She follows Christianity and her political leaning is 0.06. She has a geonameid of 292953 and her phone number is +971 770697884, and her IP address is 208.56.157.191"
    }
  }
}